{
  "schemaVersion": 1,
  "id": "interview-tests-discount-rule-001",
  "version": 1,
  "title": "Tester des partitions de remise",
  "level": "junior",
  "durationMinutes": 6,
  "skills": [
    "tests.domain"
  ],
  "question": "Comment implémenteriez-vous « Tester des partitions de remise » et quelles preuves réfutent les contournements ?",
  "observableCriteria": [
    "Chaque partition est couverte, et les deux frontières exactes sont citées",
    "L'absence de valeur redondante au milieu d'une partition est justifiée"
  ],
  "modelAnswer": "Couvrir chaque partition et les frontières exactes cent et deux cents. Je teste les deux frontières exactes, une valeur dans chaque partition et une valeur négative. O(1) en temps et O(1) en espace.",
  "commonMistakes": [
    "Multiplier les valeurs au milieu des partitions sans jamais toucher une frontière"
  ],
  "variants": [
    "Changer la frontière ou le droit tout en conservant la règle de tester des partitions de remise."
  ],
  "license": "CC-BY-4.0"
}
