{
  "schemaVersion": 1,
  "id": "interview-api-webhook-signature-001",
  "version": 1,
  "title": "Vérifier la signature HMAC d'un webhook",
  "level": "advanced",
  "durationMinutes": 8,
  "skills": [
    "security.token",
    "api.contracts"
  ],
  "question": "Comment vérifiez-vous la signature d'un webhook entrant, et quel piège fait échouer une signature pourtant authentique ?",
  "observableCriteria": [
    "La signature est recalculée sur la chaîne exacte — horodatage et corps liés — avec le secret partagé",
    "La vérification se fait sur le corps brut, avant toute désérialisation",
    "La comparaison est en temps constant et le décodage d'une signature malformée rend un refus"
  ],
  "modelAnswer": "L'émetteur et moi partageons un secret ; il signe en HMAC la chaîne horodatage-point-corps, et je recalcule le même condensat pour comparer. Le piège central est de vérifier sur le corps brut : si je désérialise puis re-sérialise, les clés se réordonnent, les espaces se normalisent, et le corps ne coïncide plus au bit près avec celui signé — la signature échoue même sur un envoi authentique. Je lis donc le corps brut, je vérifie, et je ne désérialise qu'ensuite. Je compare en temps constant, et une signature malformée — non hexadécimale, longueur incohérente — rend un refus silencieux, pas une exception. C'est la même vérification HMAC que pour un jeton, appliquée au corps d'une requête.",
  "commonMistakes": [
    "Re-sérialiser le corps avant de vérifier, rompant toute signature authentique",
    "Signer le corps seul en oubliant l'horodatage inclus dans la chaîne signée"
  ],
  "variants": [
    "Expliquer pourquoi lier l'horodatage à la signature prépare le contrôle anti-rejeu.",
    "Comparer cette vérification à celle de la signature d'un jeton."
  ],
  "license": "CC-BY-4.0"
}
