{
  "schemaVersion": 1,
  "id": "interview-s21-s24-014",
  "version": 1,
  "title": "Valider un déploiement simulé",
  "level": "junior",
  "durationMinutes": 6,
  "skills": [
    "azure.validation"
  ],
  "question": "Que prouve un déploiement simulé et que ne prouve-t-il pas ?",
  "observableCriteria": [
    "Les trois choses qu'une simulation ne prouve pas sont nommées : acceptation, disponibilité, performance",
    "Ce qu'elle prouve réellement — cohérence des fichiers et des garde-fous — n'est pas minimisé pour autant"
  ],
  "modelAnswer": "Il prouve la cohérence locale des choix, fichiers et garde-fous testés. Il ne prouve ni acceptation par Azure, ni disponibilité, ni performance réelle du service.",
  "commonMistakes": [
    "Rendre compte d'un déploiement simulé sans distinguer ce qu'il établit de ce qu'il suppose"
  ],
  "variants": [
    "Changez une contrainte du scénario « Valider un déploiement simulé » et expliquez si la décision reste valide."
  ],
  "license": "CC-BY-4.0"
}
