{
    "schemaVersion":  1,
    "id":  "interview-s21-s24-010",
    "version":  1,
    "title":  "Éviter une dépendance cloud",
    "level":  "junior",
    "durationMinutes":  6,
    "skills":  [
                   "azure.local"
               ],
    "question":  "Comment conserver un apprentissage autonome lorsque le compte Azure est absent ?",
    "observableCriteria":  [
                               "La réponse prend une décision explicite et cite une preuve observable",
                               "Une limite de sécurité, de coût, de portée ou de validité est reconnue"
                           ],
    "modelAnswer":  "Je fournis une configuration inspectable, une simulation déterministe et des preuves locales. Le déploiement réel reste une extension manuelle facultative et clairement étiquetée.",
    "commonMistakes":  [
                           "Employer un slogan sans contrainte, preuve ni limite vérifiable"
                       ],
    "variants":  [
                     "Changez une contrainte du scénario « Éviter une dépendance cloud » et expliquez si la décision reste valide."
                 ],
    "license":  "CC-BY-4.0"
}
