{
  "schemaVersion": 1,
  "id": "interview-ci-retry-backoff-001",
  "version": 1,
  "title": "Budgéter une politique de relance à recul exponentiel",
  "level": "junior",
  "durationMinutes": 6,
  "skills": ["ci.resilience"],
  "question": "Vous devez proposer une politique de relance pour les travaux qui échouent sur des causes passagères. Comment la dimensionnez-vous, et comment répondez-vous à la question « combien de temps ça nous coûte au pire » ?",
  "observableCriteria": [
    "Le recul exponentiel avec plafond est proposé et justifié contre la relance immédiate en rafale",
    "La fenêtre au pire se calcule : n tentatives donnent n moins une attentes, écrêtées au plafond",
    "Le rôle du plafond est expliqué : convertir une croissance géométrique en coût linéaire budgétable"
  ],
  "modelAnswer": "Je propose le recul exponentiel avec plafond : la première attente vaut un délai de base, chaque suivante double, et aucune ne dépasse le plafond. La rafale de relances immédiates aggrave les causes passagères — un dépôt de paquets saturé le reste davantage sous les assauts — tandis que le doublement laisse la cause s'éteindre. Le plafond a un rôle précis : sans lui, la fenêtre d'attente double à chaque tentative et personne ne peut la budgéter ; avec lui, passé le point d'écrêtage, chaque relance supplémentaire coûte exactement le plafond, et la réponse au « combien au pire » devient une phrase de réunion : tant de secondes pour les premiers doublements, puis une minute par relance. Le calcul exact compte les intervalles, pas les tentatives — rien avant la première, rien après la dernière — et se fait en doublant pas à pas avec comparaison avant doublement, parce que la puissance de deux calculée d'un coup déborde et produirait des délais absurdes. Je borne enfin la politique elle-même : au-delà d'un certain nombre de tentatives, la relance ne masque plus un incident passager, elle masque une panne qu'une alerte doit remonter.",
  "commonMistakes": [
    "Relancer sans délai et transformer chaque incident passager du fournisseur en pilonnage",
    "Compter une attente par tentative et surestimer la fenêtre de la valeur entière du plafond"
  ],
  "variants": [
    "Ajouter une gigue aléatoire et demander quel problème de troupeau elle résout.",
    "Distinguer les échecs qui méritent une relance de ceux qui n'en méritent aucune, et où coder ce tri."
  ],
  "license": "CC-BY-4.0"
}
