{
  "schemaVersion": 1,
  "id": "interview-s21-s24-007",
  "version": 1,
  "title": "Préparer la suppression Azure",
  "level": "junior",
  "durationMinutes": 6,
  "skills": [
    "azure.cost"
  ],
  "question": "Que doit contenir un plan de suppression avant un laboratoire Azure facultatif ?",
  "observableCriteria": [
    "Le plan nomme un propriétaire humain et une heure limite, pas seulement des commandes",
    "La vérification après suppression est distinguée de la commande de suppression elle-même"
  ],
  "modelAnswer": "Il nomme le groupe de ressources dédié, le propriétaire de lʼaction, la commande de vérification, lʼheure limite et la preuve finale quʼaucune ressource facturable ne subsiste.",
  "commonMistakes": [
    "Considérer la suppression faite parce que la commande a été lancée sans relever le coût résiduel"
  ],
  "variants": [
    "Changez une contrainte du scénario « Préparer la suppression Azure » et expliquez si la décision reste valide."
  ],
  "license": "CC-BY-4.0"
}
