{
  "schemaVersion": 1,
  "id": "interview-s21-s24-052",
  "version": 1,
  "title": "Report an incident update",
  "level": "advanced",
  "durationMinutes": 12,
  "skills": [
    "english.incident"
  ],
  "question": "Give the structure of a concise incident update.",
  "observableCriteria": [
    "Confirmed facts are separated from the current mitigation and from any hypothesis",
    "An owner for the next action and a next update time are both given"
  ],
  "modelAnswer": "I state observed impact and time window, confirmed facts, current mitigation, owner of the next action and next update time. I avoid an unverified root cause.",
  "commonMistakes": [
    "Reporting an unverified root cause in the same tone as an observed fact"
  ],
  "variants": [
    "Changez une contrainte du scénario « Report an incident update » et expliquez si la décision reste valide."
  ],
  "license": "CC-BY-4.0"
}
