{
  "schemaVersion": 1,
  "id": "interview-csharp-payment-fee-001",
  "version": 1,
  "title": "Calculer des frais par interface",
  "level": "junior",
  "durationMinutes": 5,
  "skills": [
    "csharp.interfaces"
  ],
  "question": "Comment résoudriez-vous « Calculer des frais par interface » et comment prouveriez-vous les bornes ?",
  "observableCriteria": [
    "Les deux implémentations sont présentées comme deux politiques, non comme deux branches d'un test",
    "Le point d'extension est nommé : ajouter une politique ne modifie pas l'appelant"
  ],
  "modelAnswer": "La branche représente deux implémentations d’une petite politique de frais. Je prouve par les deux politiques sur un même montant, un montant nul et un montant à la frontière ; O(1) en temps et O(1) en espace.",
  "commonMistakes": [
    "Ajouter une politique en modifiant la condition existante au lieu d'ajouter une implémentation"
  ],
  "variants": [
    "Changer une borne ou le volume tout en conservant la même règle de calculer des frais par interface."
  ],
  "license": "CC-BY-4.0"
}
