{
  "schemaVersion": 1,
  "id": "interview-security-login-feedback-001",
  "version": 1,
  "title": "Régler la frontière entre message public et journal de connexion",
  "level": "intermediate",
  "durationMinutes": 8,
  "skills": ["security.authentication"],
  "question": "Le produit veut afficher « compte verrouillé » et « mot de passe expiré » aux utilisateurs concernés, pour réduire les appels au support. Où tracez-vous la ligne entre ce qui peut se nommer et ce qui doit rester uniforme, et sur quel critère ?",
  "observableCriteria": [
    "Le critère de la preuve est énoncé : tout ce qui précède la vérification réussie du mot de passe s'uniformise",
    "Le verrouillage annoncé publiquement est identifié comme une confirmation d'existence du compte",
    "Le journal précis est défendu séparément, avec les signatures d'attaque qu'il permet de distinguer"
  ],
  "modelAnswer": "Mon critère est la preuve : tout ce que le système sait avant la vérification réussie du mot de passe reste sous un message uniforme, tout ce qui vient après peut se nommer. L'expiration passe ce critère : elle n'est constatée qu'après un mot de passe correct, donc l'appelant a démontré qu'il est le titulaire, et l'informer réduit les appels au support sans renseigner personne. Le verrouillage ne le passe pas : il se vérifie avant la preuve — même le bon mot de passe ne connecte pas un compte gelé — et l'annoncer confirme l'existence du compte aussi sûrement qu'un « compte inconnu », puisque seul un compte existant se verrouille. Un attaquant qui pulvérise des adresses avec un mot de passe bidon apprendrait quelles adresses existent rien qu'en lisant les messages. Pour le besoin légitime du produit, le canal correct est hors bande : un courriel au titulaire au moment du verrouillage, qui informe la bonne personne sans rien dire au guichet. Et je défends la précision du journal séparément : les défenseurs distinguent un utilisateur maladroit d'une pulvérisation par la signature des causes — uniformiser le journal aveuglerait la détection pour un bénéfice nul, l'attaquant ne le lit pas.",
  "commonMistakes": [
    "Appliquer l'uniformité au journal et priver la détection des signatures d'attaque",
    "Annoncer le verrouillage au guichet public au lieu d'informer le titulaire hors bande"
  ],
  "variants": [
    "Transposer à la réinitialisation de mot de passe : que répondre à une adresse inconnue ?",
    "Demander quels compteurs de journal alimenter pour détecter une pulvérisation en cours."
  ],
  "license": "CC-BY-4.0"
}
