{
  "schemaVersion": 1,
  "id": "interview-ci-deploy-gate-001",
  "version": 1,
  "title": "Évaluer une porte de déploiement",
  "level": "intermediate",
  "durationMinutes": 6,
  "skills": [
    "ci.deployment"
  ],
  "question": "Comment implémenteriez-vous « Évaluer une porte de déploiement » et quelles preuves réfutent les contournements ?",
  "observableCriteria": [
    "Les trois conditions sont exigées simultanément et la porte est fermée par défaut",
    "L'approbation est distinguée des preuves automatiques"
  ],
  "modelAnswer": "Exiger simultanément preuves vertes, environnement protégé et approbation. Je couvre les huit combinaisons des trois conditions, le domaine booléen étant ici épuisable. O(1) en temps et O(1) en espace.",
  "commonMistakes": [
    "Ouvrir la porte sur les preuves vertes seules, en considérant l'approbation comme une formalité"
  ],
  "variants": [
    "Changer la frontière ou le droit tout en conservant la règle de évaluer une porte de déploiement."
  ],
  "license": "CC-BY-4.0"
}
