{
    "schemaVersion":  1,
    "id":  "interview-s21-s24-031",
    "version":  1,
    "title":  "Écrire une décision dʼarchitecture",
    "level":  "intermediate",
    "durationMinutes":  9,
    "skills":  [
                   "project.architecture"
               ],
    "question":  "Que contient une décision révisable ?",
    "observableCriteria":  [
                               "La réponse prend une décision explicite et cite une preuve observable",
                               "Une limite de sécurité, de coût, de portée ou de validité est reconnue"
                           ],
    "modelAnswer":  "Contexte, forces, options, choix, conséquences, risques, date et signal de réexamen. Elle cite une preuve plutôt quʼune préférence personnelle.",
    "commonMistakes":  [
                           "Employer un slogan sans contrainte, preuve ni limite vérifiable"
                       ],
    "variants":  [
                     "Changez une contrainte du scénario « Écrire une décision dʼarchitecture » et expliquez si la décision reste valide."
                 ],
    "license":  "CC-BY-4.0"
}
