{
    "schemaVersion":  1,
    "id":  "interview-azure-secret-source-001",
    "version":  1,
    "title":  "Choisir une source de valeur sensible",
    "level":  "intermediate",
    "durationMinutes":  7,
    "skills":  [
                   "azure.identity"
               ],
    "question":  "Comment implémenteriez-vous « Choisir une source de valeur sensible » et quelles preuves empêchent un contournement ?",
    "observableCriteria":  [
                               "Le contrat, une frontière et un refus sont explicités",
                               "La limite du mode local et le coût ou risque associé sont justifiés"
                           ],
    "modelAnswer":  "Une valeur non sensible reste en configuration ; une valeur sensible utilise lʼidentité gérée ou un magasin local hors Git. Je sépare validation et décision, je teste nominal et frontières, puis je vérifie quʼaucun appel cloud ni donnée sensible nʼentre dans la preuve. O(1) en temps et O(1) en espace.",
    "commonMistakes":  [
                           "Réciter le code sans expliquer le contrat, le coût ou la preuve"
                       ],
    "variants":  [
                     "Changer une contrainte tout en conservant la règle de choisir une source de valeur sensible."
                 ],
    "license":  "CC-BY-4.0"
}
