{
  "schemaVersion": 1,
  "id": "interview-tests-boundary-probe-001",
  "version": 1,
  "title": "Produire les sondes qui réfutent un décalage de borne",
  "level": "junior",
  "durationMinutes": 7,
  "skills": ["tests.boundaries"],
  "question": "Une règle accepte une quantité de un à cent. Quelles valeurs testez-vous, combien, et pourquoi celles-là plutôt que d'autres ?",
  "observableCriteria": [
    "Les quatre sondes sont nommées et rattachées chacune à une erreur qu'elle réfute",
    "La redondance du milieu de l'intervalle est identifiée comme telle",
    "Le cas d'une borne appuyée sur la limite du type est évoqué comme un débordement possible"
  ],
  "modelAnswer": "Je teste quatre valeurs : zéro et un du côté bas, cent et cent un du côté haut. Chaque borne peut être fausse de deux façons, trop large ou trop stricte ; la valeur juste à l'extérieur réfute la version trop large, celle juste à l'intérieur réfute la version trop stricte. Tester cinquante n'ajoute rien, parce que c'est la même comparaison qui décide pour toutes les valeurs du milieu. Je fais attention à un cas particulier : si une borne est posée sur la plus petite ou la plus grande valeur du type, la sonde extérieure n'existe pas, et la calculer quand même déborde en silence — la sonde atterrit alors à l'autre extrémité et teste l'inverse de mon intention. Enfin, si les deux bornes sont confondues, trois sondes suffisent, puisque la même valeur est à la fois la première et la dernière acceptée.",
  "commonMistakes": [
    "Multiplier les valeurs du milieu, qui n'ajoutent aucune capacité de réfutation",
    "Calculer une sonde au-delà d'une limite du type sans le vérifier"
  ],
  "variants": [
    "Passer à un intervalle ouvert d'un côté et demander ce qui change.",
    "Remplacer les entiers par des montants décimaux et demander ce que devient la notion de valeur voisine."
  ],
  "license": "CC-BY-4.0"
}
